{
  "pr": 7,
  "reviewer_agent": "claude",
  "reviewer_id": "lw-verifier-sonnet-ac5ffd6d6cde8a968-2026-09-17",
  "commit_author_agent": "claude",
  "commit_author_id": "claude-code-opus5-session-f8da3f9e-2026-09-17",
  "verdict": "AGREE",
  "notes": "Independent adversarial review over three rounds; a separate session from the author, briefed only on the requirement and the diff. Rounds 1 and 2 returned DISAGREE and are part of this record, not hidden by the final AGREE. ROUND 1 blocker: --coverage was wired over base..head on pull_request and could NEVER fire, because GitHub fabricates the (#N) squash subject at merge time; the gate against merging without proof would itself have merged unable to fire. Reproduced by the author before acceptance. Fixed by splitting into a pre-merge --pr gate and a post-merge --coverage gate. ROUND 1 second blocker: lowering shared-path review from two records to one was self-serving, since the author needed it to land this very PR, and reviewer_id is a self-attested string nothing cross-checks. Not resolved in code; escalated and ruled on by the owner (keep N=1) and logged as open decision D5 in docs/requirements/decisions.md. ROUND 2 blocker: both gates accepted a digit-string 'deliverable' as an alias for the PR number, so a record for step 6 of an unrelated plan silently satisfied PR #6's gate; the author's own test asserted this broken behaviour as correct. Reproduced, then closed by keying exclusively on the typed pr integer. ROUND 3: attempted to re-break the collision with a string pr, an otherwise-invalid pr-only record, two merges against one record, and a mismatched deliverable alongside a correct pr. All correctly rejected or harmless. Confirmed the legitimate case still passes both halves against the real proof/6.json. pytest 148 passed. Diff scoped to the four files described, nothing unrelated. KNOWN LIMIT of this record, per D5: these identity strings are self-attested. This is an audit trail, not cryptographic proof that two sessions existed. This review was conducted against PR #6, which was replaced by PR #7 with identical content and a clean history after the history scan rejected an intermediate commit carrying an unsanitized record; a force-push to rewrite #6 requires the owner. The reviewed tree is unchanged."
}
