{
  "pr": 9,
  "reviewer_agent": "claude",
  "reviewer_id": "lw-verifier-sonnet-a6151e151a0c14230-2026-09-18",
  "commit_author_agent": "claude",
  "commit_author_id": "claude-code-opus5-session-f8da3f9e-2026-09-18",
  "verdict": "AGREE",
  "notes": "Independent review by a separate session from the author, of a HANDOFF.md-only change. No blockers. Verified every factual claim in the rewritten in-flight item 3 against the tree: docs/requirements/vision.md exists and states owner-approved 2026-09-18; approach.md's package list has exactly 13 sections so 'twelve remain' is arithmetically correct with section 1 done; decisions.md carries D1 through D8; D5 is explicitly marked 'Open decision, NOT settled' about binding reviewer identity to something externally verifiable; owner-directives.md is still literally headed TODO placeholder. Generated block checked against reality: main SHA matches git rev-parse, and both proof lines match proof/7.json and proof/8.json exactly. Size 2826 bytes, under the 3000 cap. Diff touches one file. 148 tests pass, leak scan clean at 6 needles. Spot-checked untouched claims too: the two GitHub App manifests exist as manifests only, matching the 'not created' wording, and ruleset 23627212 is live. ONE ROUGH EDGE RAISED AND JUDGED NON-BLOCKING: the generated block's Open PRs line reads '(unavailable: no gh auth in this environment, or no open PRs)' while PR #9 is open. Traced to lwb_handoff.py::_generate_block conflating an empty gh result with an auth failure into one ambiguous string -- pre-existing, untouched by this diff, and the block is generated before the PR is opened, so an empty list may have been correct at that moment. docs/handoff-protocol.md already documents this degradation as a trap and puts 'gh pr list --state open' first in the re-derive checklist, so a cold session following the protocol is not misled. Recommended as a follow-up: distinguish 'no gh auth' from 'zero open PRs' in the generated text, and regenerate the block after opening the PR rather than before. KNOWN LIMIT per open decision D5: these identity strings are self-attested and nothing cross-checks them against git authorship or a session registry. This is an audit trail, not cryptographic proof that two sessions existed."
}
