{
  "pr": 8,
  "reviewer_agent": "claude",
  "reviewer_id": "lw-verifier-sonnet-ad3ea914282f274fd-2026-09-18",
  "commit_author_agent": "claude",
  "commit_author_id": "claude-code-opus5-session-f8da3f9e-2026-09-18",
  "verdict": "AGREE",
  "notes": "Independent adversarial review over two rounds by a separate session from the author, briefed only on the requirement and the diff. Round 1 returned DISAGREE and is part of this record, not hidden by the final AGREE. Round 1 blockers, both false statements of fact in a document whose stated thesis is 'evidence over assertion', both asserted by the author without checking: (1) the scope table claimed plugins/codex/lwb was 'skills, no hook', but plugins/codex/lwb/hooks/hooks.json registers a PreToolUse hook running bin/lwb_hook.py through the same lwb_core.engine.evaluate as the Claude plugin, and README.md's own table already said so -- the new document contradicted the file it claims consistency with, on a fact listable from the tree; (2) 'Fourteen exist under scripts/' was an arithmetic error against the document's own enumeration of 13 scripts plus two validators, and against ls scripts/lwb_*.py which returns 15. Round 2 confirmed both fixes: diff scoped to exactly two lines in one file, codex row now accurate against the tree and consistent with README, count now agreeing with both the enumeration and the filesystem, nothing else disturbed. Also verified across both rounds and found sound: every other EXISTS/PROPOSED row against the actual tree; the four named skills present and the four PROPOSED skills absent; RULES = [lwb_version] only, matching the document's own 'one no-op rule' claim; all three sub-claims of the 2026-09-17 failure log corroborated against commits e512b2a and 4a62f6e with no overstatement found; the seven-stage list, warn-only phasing and independence rule matching decisions D1, D2 and D3 verbatim; README carrying no remnant of the superseded 'generic SDLC / mechanical' framing; leak scan clean at 6 needles; 148 tests passing. KNOWN LIMIT, per open decision D5 in docs/requirements/decisions.md: these identity strings are self-attested and nothing cross-checks them against git authorship or a session registry. This is an audit trail, not cryptographic proof that two sessions existed."
}
