{
  "pr": 11,
  "reviewer_agent": "claude",
  "reviewer_id": "lw-verifier-sonnet-a2b55fab21ab1af76-2026-09-18",
  "commit_author_agent": "claude",
  "commit_author_id": "claude-code-opus5-session-f8da3f9e-2026-09-18",
  "verdict": "AGREE",
  "notes": "Independent review by a separate session from the author, of a rename: docs/requirements/vision.md to mission.md with its heading changed to match and references updated. No blockers. Verified the rename is complete by grepping the branch for 'vision' outside proof/ and reviews/ and accounting for every hit: exactly two remain and both are correct to leave, LICENSE's 'revisions' substring and HANDOFF.md's autogenerated 'lwb-vision: PROVEN' line inside the generated block, which is a historical deliverable id sourced from proof/8.json and would be overwritten by the generator anyway. Verified content preservation by diffing main:docs/requirements/vision.md against the branch's mission.md: exactly one line differs, the heading. Confirmed proof/ and reviews/ were untouched, so proof/8.json still names the old path as history rather than being rewritten to agree with a later rename. Confirmed no dangling references: both updated links resolve. Independently judged the rename's own rationale honest by reading all 129 lines and confirming the document contains no future state, no target users and no what-is-true-if-this-works, so calling it a vision did overstate it. Ran git merge-tree against main at 4cf8f67 and found clean auto-merges with no conflict, the branch merely stale by PR #10. handoff --check 2827 bytes under the cap, 148 tests pass, leak scan clean at 6 needles. DISCLOSED BY THE REVIEWER, unprompted: mid-review it mistakenly ran a checkout that staged branch content into the main working tree, caught it immediately, reset hard, verified clean, and completed the rest of the review from git refs and an isolated worktree which it then removed. Recorded here rather than omitted, because a review record that hides the reviewer's own error is worth less than one that does not. KNOWN LIMIT per open decision D5: these identity strings are self-attested and nothing cross-checks them against git authorship or a session registry. This is an audit trail, not cryptographic proof that two sessions existed."
}
