{
  "pr": 10,
  "reviewer_agent": "claude",
  "reviewer_id": "lw-verifier-sonnet-acc84f592377940aa-2026-09-18",
  "commit_author_agent": "claude",
  "commit_author_id": "claude-code-opus5-session-f8da3f9e-2026-09-18",
  "verdict": "AGREE",
  "notes": "Independent review by a separate session from the author, of a docs/handoff-protocol.md-only change adding one Hard rules bullet and two Traps bullets. No blockers, no minor issues. The reviewer did not take the document's git claims on trust -- it reproduced them live in a throwaway repo: init, feature branch, squash-merge, then `git branch -d feature` exited 1 refusing as not fully merged, and `git branch -D feature` exited 0, confirming that -D is genuinely required for a squash-merged branch. It confirmed that diffing a branch tip against the squash commit it produced is the correct landed-work test because that commit's tree is frozen at merge time, whereas diffing against current main can never show no-diff once main advances -- which is exactly the broken rule a worker refused to act on earlier in the session. It confirmed from .github/workflows/ci.yml that every job starts from actions/checkout@v7, a fresh clone, so local branches, stashes and untracked files genuinely cannot be seen by CI and a CI-based hygiene check would always pass. It ran the recommended `git for-each-ref --format='%(refname)' refs/heads refs/remotes` and confirmed one ref per line with no condensation. It checked the rest of handoff-protocol.md, CLAUDE.md and the mission document for contradictions and found none, noting the new text documents the trap without claiming a Stop-hook rule already exists. lwb_handoff.py --check passes with all four required headings intact, 148 tests pass, leak scan clean at 6 needles, diff scoped to one file, 23 insertions 0 deletions. KNOWN LIMIT per open decision D5 in docs/requirements/decisions.md: these identity strings are self-attested and nothing cross-checks them against git authorship or a session registry. This is an audit trail, not cryptographic proof that two sessions existed."
}
